{
  "sessionCounts": {
    "draft": 8,
    "plan_ready": 1,
    "queued": 9,
    "running": 4,
    "awaiting_review": 5,
    "revising": 1,
    "succeeded": 3,
    "failed": 18,
    "cancelled": 0
  },
  "recentSessions": [
    {
      "id": "b5742852-c1d4-48c8-8ee2-fcd30f5bdc30",
      "status": "failed",
      "engine": "copilot_agent",
      "repoConnectionId": "83eb13c8-8604-4f4f-af8d-7f94be63ac9d",
      "sourceRef": "AS",
      "approvedCaseId": "AS",
      "createdAt": "2026-07-21T11:12:06.298100+00:00",
      "updatedAt": "2026-07-21T11:25:25.878534+00:00",
      "jobStatus": "failed",
      "currentRoundNumber": 1
    },
    {
      "id": "2deb88f8-f7fa-4ea3-97cf-fde48cc6c0ff",
      "status": "plan_ready",
      "engine": "copilot_agent",
      "repoConnectionId": "fe124fc6-aa4a-4166-9c59-b1fd87a3788a",
      "sourceRef": "copilot-render-test-after-cli-fix",
      "approvedCaseId": "copilot-render-test-after-cli-fix",
      "createdAt": "2026-07-10T12:21:22.569723+00:00",
      "updatedAt": "2026-07-21T10:44:06.229518+00:00",
      "jobStatus": "awaiting_plan_approval",
      "currentRoundNumber": 0
    },
    {
      "id": "4e667c69-e168-47ed-a9b1-03a8a2b1d349",
      "status": "failed",
      "engine": "copilot_agent",
      "repoConnectionId": "fe124fc6-aa4a-4166-9c59-b1fd87a3788a",
      "sourceRef": "fvdvfd",
      "approvedCaseId": "fvdvfd",
      "createdAt": "2026-07-20T11:55:31.579700+00:00",
      "updatedAt": "2026-07-20T13:10:23.722591+00:00",
      "jobStatus": "pr_creation_failed",
      "currentRoundNumber": 1
    },
    {
      "id": "640df16f-8470-4ee6-b6fa-820aa2e07912",
      "status": "awaiting_review",
      "engine": "copilot_agent",
      "repoConnectionId": "fe124fc6-aa4a-4166-9c59-b1fd87a3788a",
      "sourceRef": "copilot-write-flags-test-1",
      "approvedCaseId": "copilot-write-flags-test-1",
      "createdAt": "2026-07-14T12:27:24.543604+00:00",
      "updatedAt": "2026-07-20T11:23:02.445850+00:00",
      "jobStatus": "awaiting_automation_review",
      "currentRoundNumber": 1
    },
    {
      "id": "1b6aedcd-b1c1-4472-8723-57550c61c1ec",
      "status": "failed",
      "engine": "copilot_agent",
      "repoConnectionId": "825a9881-a648-4b80-99b5-e3ddf51c1522",
      "sourceRef": "svfs",
      "approvedCaseId": "svfs",
      "createdAt": "2026-07-20T11:20:19.287095+00:00",
      "updatedAt": "2026-07-20T11:20:30.957657+00:00",
      "jobStatus": "failed",
      "currentRoundNumber": 0
    },
    {
      "id": "905e729b-936d-4553-935e-42f3beb23251",
      "status": "failed",
      "engine": "copilot_agent",
      "repoConnectionId": "825a9881-a648-4b80-99b5-e3ddf51c1522",
      "sourceRef": "Source 1",
      "approvedCaseId": "Source 1",
      "createdAt": "2026-07-20T11:00:47.061929+00:00",
      "updatedAt": "2026-07-20T11:01:28.375057+00:00",
      "jobStatus": "failed",
      "currentRoundNumber": 0
    },
    {
      "id": "f32c66b5-38b8-4933-b617-97b2120d6410",
      "status": "failed",
      "engine": "copilot_agent",
      "repoConnectionId": "825a9881-a648-4b80-99b5-e3ddf51c1522",
      "sourceRef": "hu",
      "approvedCaseId": "hu",
      "createdAt": "2026-07-20T10:10:45.317601+00:00",
      "updatedAt": "2026-07-20T10:10:54.210385+00:00",
      "jobStatus": "failed",
      "currentRoundNumber": 0
    },
    {
      "id": "52735d04-0c8f-4bfd-9f81-f06c535b5eb2",
      "status": "failed",
      "engine": "copilot_agent",
      "repoConnectionId": "fe124fc6-aa4a-4166-9c59-b1fd87a3788a",
      "sourceRef": "copilot-guardrail-test-1",
      "approvedCaseId": "copilot-guardrail-test-1",
      "createdAt": "2026-07-14T11:00:39.637642+00:00",
      "updatedAt": "2026-07-20T08:30:11.703789+00:00",
      "jobStatus": "pr_creation_failed",
      "currentRoundNumber": 1
    },
    {
      "id": "b04c0d7a-e204-477e-8b5b-a16cda88b3ef",
      "status": "failed",
      "engine": "copilot_agent",
      "repoConnectionId": "fe124fc6-aa4a-4166-9c59-b1fd87a3788a",
      "sourceRef": "nh",
      "approvedCaseId": "nh",
      "createdAt": "2026-07-16T09:05:54.733090+00:00",
      "updatedAt": "2026-07-17T15:19:35.463836+00:00",
      "jobStatus": "pr_creation_failed",
      "currentRoundNumber": 1
    },
    {
      "id": "510aa916-6f31-421f-93b7-76bcfe3a0c75",
      "status": "succeeded",
      "engine": "copilot_agent",
      "repoConnectionId": "fe124fc6-aa4a-4166-9c59-b1fd87a3788a",
      "sourceRef": "copilot-inline-poc-test-1",
      "approvedCaseId": "copilot-inline-poc-test-1",
      "createdAt": "2026-07-14T14:24:25.300188+00:00",
      "updatedAt": "2026-07-14T15:17:05.468179+00:00",
      "jobStatus": "pr_created",
      "currentRoundNumber": 2
    },
    {
      "id": "22f0f44e-b6aa-4a99-bd2b-55631d7c7c99",
      "status": "queued",
      "engine": "copilot_agent",
      "repoConnectionId": "fe124fc6-aa4a-4166-9c59-b1fd87a3788a",
      "sourceRef": "copilot-write-flags-test-1",
      "approvedCaseId": "copilot-write-flags-test-1",
      "createdAt": "2026-07-14T13:24:36.796720+00:00",
      "updatedAt": "2026-07-14T13:25:03.981781+00:00",
      "jobStatus": "queued",
      "currentRoundNumber": 0
    },
    {
      "id": "50922257-42ca-45df-8285-c227b750cb9c",
      "status": "draft",
      "engine": "copilot_agent",
      "repoConnectionId": "fe124fc6-aa4a-4166-9c59-b1fd87a3788a",
      "sourceRef": "copilot-write-flags-test-1",
      "approvedCaseId": "copilot-write-flags-test-1",
      "createdAt": "2026-07-14T11:43:02.038072+00:00",
      "updatedAt": "2026-07-14T11:43:02.038072+00:00",
      "jobStatus": "pending",
      "currentRoundNumber": 0
    }
  ],
  "repositoryConnectionCount": 5,
  "branchPolicyCount": 3,
  "environment": "local",
  "applicationName": "qswarm-backend"
}